{
  "$schema": "../../schemas/hswm_root_asset_migrations.v1.schema.json",
  "schema_version": "hswm-root-asset-migrations/v1",
  "status": "SOURCE_PINNED_PATH_MIGRATION",
  "source_commit": "206f2c64f69c9c9dc2870a50eebe38b59f58a5b0",
  "policy": "Move the remaining current-digest-unbound research documents, core-development guides, F3v2 preregistration, and maintenance shell out of the repository root. Historical receipts, preregistrations, manifests, and root-tidy records retain their original path payloads; the pinned source commit preserves exact detached replay.",
  "migrations": [
    {
      "old_path": "ABSORB_CONTRACT_v1.md",
      "canonical_path": "docs/research/ABSORB_CONTRACT_v1.md",
      "destination_kind": "research-document",
      "source_sha256": "f06048ff15b64f79ab2ce8d04b301576fe7a85d1b0aa36885e90e3722d82652c"
    },
    {
      "old_path": "AMENDMENT_OPEN_HSWM_KERNEL_V2_2026-07-22.md",
      "canonical_path": "docs/research/AMENDMENT_OPEN_HSWM_KERNEL_V2_2026-07-22.md",
      "destination_kind": "research-document",
      "source_sha256": "2a631c5a584b9971c42cebcf568826e2bb6ffe54e0c1c809be48211e489a26fb"
    },
    {
      "old_path": "DESIGN_PHASE_B_FEDERATED_HSWM_2026-07-22.md",
      "canonical_path": "docs/research/DESIGN_PHASE_B_FEDERATED_HSWM_2026-07-22.md",
      "destination_kind": "research-document",
      "source_sha256": "a37f454be086c980077da370343a3899e7da22cfb9d7d64b71290dd909508287"
    },
    {
      "old_path": "EXISTENCE_SCOREBOARD.v1.md",
      "canonical_path": "docs/research/core-development/EXISTENCE_SCOREBOARD.v1.md",
      "destination_kind": "research-document",
      "source_sha256": "7143b80a08f4e7a28d36421460f7186980c58b4d8a1d40249e5526391c589717"
    },
    {
      "old_path": "H3_C0_CHAIN_VIABILITY_DIAGNOSIS_2026-07-20.md",
      "canonical_path": "docs/research/H3_C0_CHAIN_VIABILITY_DIAGNOSIS_2026-07-20.md",
      "destination_kind": "research-document",
      "source_sha256": "5a3f0d4bb894fd5165c4f49cf61281b7f978a894442901d4e085575af751c623"
    },
    {
      "old_path": "HSWM_CORE_DEV.md",
      "canonical_path": "docs/research/core-development/HSWM_CORE_DEV.md",
      "destination_kind": "research-document",
      "source_sha256": "3b6e2c966ab52d8ab7247ad43f51de090e6dac1a4f1d747f18d117b4c856d61a"
    },
    {
      "old_path": "HSWM_CORE_EXISTENCE_CONCENTRATION.md",
      "canonical_path": "docs/research/core-development/HSWM_CORE_EXISTENCE_CONCENTRATION.md",
      "destination_kind": "research-document",
      "source_sha256": "311de24edcbf29579b998ab0fafedd2dc6179cf667c95c93427dc939a55c98e6"
    },
    {
      "old_path": "PREREG_F3V2_HARDER_TRANSFER_2026-07-26.md",
      "canonical_path": "prereg/PREREG_F3V2_HARDER_TRANSFER_2026-07-26.md",
      "destination_kind": "preregistration",
      "source_sha256": "417a08a3fa05244c6d04e16f22e2a5ce2694dc91541a469dca6a0316f67e13cf"
    },
    {
      "old_path": "PROM_16_WORLD_COMPILER_CERTIFIED_READOUT_ENVELOPE_2026-07-20.md",
      "canonical_path": "docs/research/PROM_16_WORLD_COMPILER_CERTIFIED_READOUT_ENVELOPE_2026-07-20.md",
      "destination_kind": "research-document",
      "source_sha256": "06ccd7667050e390f59f5ca2de1e85ce373c33282cc438e3c3dd4435a53141fc"
    },
    {
      "old_path": "PROM_8_DYNAMIC_TWO_LANES_2026-07-22.md",
      "canonical_path": "docs/research/PROM_8_DYNAMIC_TWO_LANES_2026-07-22.md",
      "destination_kind": "research-document",
      "source_sha256": "167d61426073748e1e8cdd113ef0c76843fdd8cd3850a11d3665ada20b4bc73e"
    },
    {
      "old_path": "PROM_KQV_ATTENTION_BACKBONE_2026-07-19.md",
      "canonical_path": "docs/research/PROM_KQV_ATTENTION_BACKBONE_2026-07-19.md",
      "destination_kind": "research-document",
      "source_sha256": "29fed750157750b99843d21b0961131ee3c6880453a3e3d9da1116ed76111f25"
    },
    {
      "old_path": "PROM_TRAVERSAL_DESIGN_2026-07-19.md",
      "canonical_path": "docs/research/PROM_TRAVERSAL_DESIGN_2026-07-19.md",
      "destination_kind": "research-document",
      "source_sha256": "f2982912903ef8fe496a007f4b8438dcd4c7d0ba873296251c2357d7344d694a"
    },
    {
      "old_path": "PROM_WOLFRAM_IMPORT_2026-07-19.md",
      "canonical_path": "docs/research/PROM_WOLFRAM_IMPORT_2026-07-19.md",
      "destination_kind": "research-document",
      "source_sha256": "7b3b37f6327cd8ca69571b4e7ad3a1492b0893f7191ff44dcb439e82e7f6add3"
    },
    {
      "old_path": "WOLFRAM_OSS_SOURCES_2026-07-20.md",
      "canonical_path": "docs/research/WOLFRAM_OSS_SOURCES_2026-07-20.md",
      "destination_kind": "research-document",
      "source_sha256": "26679cd5fbe7453b1f753e06505271e059719b648fd1cdd3c35fbfaf4fd05d8e"
    },
    {
      "old_path": "WORLD_COMPILER_V2_OSS_PROM_2026-07-21.md",
      "canonical_path": "docs/research/WORLD_COMPILER_V2_OSS_PROM_2026-07-21.md",
      "destination_kind": "research-document",
      "source_sha256": "b6a88b14a4538685d21eddeb034a6c3a0dfd0e827536a73e57fce1d64465d9f4"
    },
    {
      "old_path": "f3v2_smoke_preflight.sh",
      "canonical_path": "scripts/f3v2_smoke_preflight.sh",
      "destination_kind": "maintenance-shell",
      "source_sha256": "10f00212fac719fc85b7f50c9271eed4fe97a40fa9d96c34bf2942aa3713f904"
    }
  ]
}
