{
  "$schema": "../../schemas/hswm_root_asset_migrations.v1.schema.json",
  "schema_version": "hswm-root-asset-migrations/v1",
  "status": "SOURCE_PINNED_PATH_MIGRATION",
  "source_commit": "33556a55530bdc0912154abc8c19897f89b0dcda",
  "migrations": [
    {
      "old_path": "CANON_DIRECTION_NEURAL_COGNITIVE_ENTITY_2026-07-23.md",
      "canonical_path": "_research/root_compat/CANON_DIRECTION_NEURAL_COGNITIVE_ENTITY_2026-07-23.md",
      "destination_kind": "compatibility-record",
      "source_sha256": "9cf5c18421187e777527bf93729209880e04f0eef962210c4e2ea65e5ae7fdd8"
    },
    {
      "old_path": "DEFINITION_HSWM_CELLULAR_METANEURAL_SYSTEM_2026-07-26.md",
      "canonical_path": "_research/root_compat/DEFINITION_HSWM_CELLULAR_METANEURAL_SYSTEM_2026-07-26.md",
      "destination_kind": "compatibility-record",
      "source_sha256": "0e3a3275507986d0e1d8f49e45ac8b9ee030333bf7333f7f76ac1d4c99119f44"
    },
    {
      "old_path": "H3_B3_COMPOSITION_PREREG_2026-07-20.md",
      "canonical_path": "_research/root_compat/H3_B3_COMPOSITION_PREREG_2026-07-20.md",
      "destination_kind": "compatibility-record",
      "source_sha256": "338a8859a7e2eebbea9c804d75f6b8e0db09d7ddf6b91db939cb30bae9f59a31"
    },
    {
      "old_path": "H3_B3_V3_REFUSAL_2026-07-20.md",
      "canonical_path": "_research/root_compat/H3_B3_V3_REFUSAL_2026-07-20.md",
      "destination_kind": "compatibility-record",
      "source_sha256": "e3a4b6043f3219d4ce585c6cb7dcba45c3be5f96c3b2e51cd98d27b8ba0c435d"
    },
    {
      "old_path": "H3_B3_V4_PREOUTPUT_REFUSAL_2026-07-20.md",
      "canonical_path": "_research/root_compat/H3_B3_V4_PREOUTPUT_REFUSAL_2026-07-20.md",
      "destination_kind": "compatibility-record",
      "source_sha256": "9cf599b18e49d9342576f5a201a7d3312465c6a71a0ed6946b155ea9294042d7"
    },
    {
      "old_path": "H3_B3_V4_RESTART_PREREG_2026-07-20.md",
      "canonical_path": "_research/root_compat/H3_B3_V4_RESTART_PREREG_2026-07-20.md",
      "destination_kind": "compatibility-record",
      "source_sha256": "01f130c683d016a2f235500acae9fb3b4242e40dbe0afa2376310d938d5db9f4"
    },
    {
      "old_path": "H3_B3_V5_RESTART_PREREG_2026-07-20.md",
      "canonical_path": "_research/root_compat/H3_B3_V5_RESTART_PREREG_2026-07-20.md",
      "destination_kind": "compatibility-record",
      "source_sha256": "253ffd9e2550b30f6aa3c2d3144d4524a6f6c18ed9849f795553218e03e7eebb"
    },
    {
      "old_path": "HSWM_CANONICAL_RESEARCH_DIRECTION_20260724.md",
      "canonical_path": "_research/root_compat/HSWM_CANONICAL_RESEARCH_DIRECTION_20260724.md",
      "destination_kind": "compatibility-record",
      "source_sha256": "6037794a604fcb0677a4adeac9d35656f6c35f5eb6327972acc389d1a298ea43"
    },
    {
      "old_path": "HSWM_CELLULAR_DURABLE_RUNTIME_V2_2026-07-26.md",
      "canonical_path": "_research/root_compat/HSWM_CELLULAR_DURABLE_RUNTIME_V2_2026-07-26.md",
      "destination_kind": "compatibility-record",
      "source_sha256": "70c0a4c659b06472bd4dc3f47bbc2ff36a380df7ef2ee0bc930090390fb01334"
    },
    {
      "old_path": "HSWM_CELLULAR_LEAN_CONDITIONS_2026-07-26.md",
      "canonical_path": "_research/root_compat/HSWM_CELLULAR_LEAN_CONDITIONS_2026-07-26.md",
      "destination_kind": "compatibility-record",
      "source_sha256": "0a1f29468fd011cd00cc9b04c88b7dd8b66e74f1dfb406da3b32a560d09877a0"
    },
    {
      "old_path": "HSWM_CELLULAR_RUNTIME_V1_2026-07-26.md",
      "canonical_path": "_research/root_compat/HSWM_CELLULAR_RUNTIME_V1_2026-07-26.md",
      "destination_kind": "compatibility-record",
      "source_sha256": "0bcdb2005a3b79e5edf9c0261f57769bd64118d4006288932405f56f1be50663"
    },
    {
      "old_path": "LONGINUS_HSWM_CELLULAR_DEFINITION_BINDING_2026-07-26.json",
      "canonical_path": "_research/root_compat/LONGINUS_HSWM_CELLULAR_DEFINITION_BINDING_2026-07-26.json",
      "destination_kind": "compatibility-record",
      "source_sha256": "9a02323c389526ace093b61cc7edf3195563a39eda5657d05c6535fc7b8bb5eb"
    },
    {
      "old_path": "LONGINUS_HSWM_CELLULAR_RUNTIME_BINDING_2026-07-26.json",
      "canonical_path": "_research/root_compat/LONGINUS_HSWM_CELLULAR_RUNTIME_BINDING_2026-07-26.json",
      "destination_kind": "compatibility-record",
      "source_sha256": "f896f3ff821b0581d0ecf9ee150f2b01ace0f41bf5e18aa6a02357976ceeb9c4"
    },
    {
      "old_path": "LONGINUS_HSWM_DURABLE_RUNTIME_BINDING_2026-07-26.json",
      "canonical_path": "_research/root_compat/LONGINUS_HSWM_DURABLE_RUNTIME_BINDING_2026-07-26.json",
      "destination_kind": "compatibility-record",
      "source_sha256": "46a5112a06585d3e51ebd6edd5d96ad49123a56cdfa7256a130f3b01fc0112ef"
    },
    {
      "old_path": "PROM_16_HSWM_SEMANTIC_WEIGHT_FIELD_MATHEMATICS_2026-07-26.md",
      "canonical_path": "_research/root_compat/PROM_16_HSWM_SEMANTIC_WEIGHT_FIELD_MATHEMATICS_2026-07-26.md",
      "destination_kind": "compatibility-record",
      "source_sha256": "8a33af2adc08f97bf15867ea1a3d7dac3afaae56193c6315460716872a97e8a8"
    },
    {
      "old_path": "PROM_16_UNPROVEN_CLAIMS_2026-07-25.md",
      "canonical_path": "_research/root_compat/PROM_16_UNPROVEN_CLAIMS_2026-07-25.md",
      "destination_kind": "compatibility-record",
      "source_sha256": "e9dd23892d0199e7107968c021be6c3d2ec5590bda0d4ffe84a91a5d3cde0953"
    },
    {
      "old_path": "semantic_layer_fixture_manifest.json",
      "canonical_path": "_research/root_compat/semantic_layer_fixture_manifest.json",
      "destination_kind": "compatibility-record",
      "source_sha256": "6ad8d73d8cb406dea6dc1d0b6f45fd5f5f5644c481262c960b46c914c4b5cbff"
    },
    {
      "old_path": "SEMANTIC_QKV_EXPERIMENT_PLAN_2026-07-20.md",
      "canonical_path": "_research/root_compat/SEMANTIC_QKV_EXPERIMENT_PLAN_2026-07-20.md",
      "destination_kind": "compatibility-record",
      "source_sha256": "85b12eb758ea6e374ce6c22dd2659e12e9b3acba4a9b9788886842b0a52945a2"
    },
    {
      "old_path": "SOURCES.md",
      "canonical_path": "_research/root_compat/SOURCES.md",
      "destination_kind": "compatibility-record",
      "source_sha256": "8e7689cd4bcf9b36c7f9822e5a80c86a8846d9ae41021f752670221290885957"
    },
    {
      "old_path": "TRIBUNAL_PHASOR_AGENTS_PRIOR_ART_2026-07-23.md",
      "canonical_path": "_research/root_compat/TRIBUNAL_PHASOR_AGENTS_PRIOR_ART_2026-07-23.md",
      "destination_kind": "compatibility-record",
      "source_sha256": "269ae5a9b04d38b68c981f9517f17aa40d80e7751459d77048fa7a5040fda2f1"
    }
  ]
}
